{
  "standardVersion": "1.0.0",
  "repository": "kemiller2002/chrona",
  "revision": "a5833bcd7f67f07e6dfcd3c61bdbd7dd0d8017a8",
  "classification": "app-ui",
  "surfaces": [
    {
      "id": "app-shell",
      "path": "web/index.html (sidebar, tab bar, top bar on every screen)",
      "kind": "product",
      "status": "pass",
      "viewportWidths": [
        320,
        390,
        768,
        1280
      ],
      "alignmentGroups": [
        {
          "id": "topbar-actions",
          "relation": "centerline",
          "toleranceCssPx": 1,
          "targets": [
            {
              "role": "button",
              "name": "Copy link"
            },
            {
              "role": "img",
              "name": "Local session"
            }
          ],
          "rationale": "The top bar's action and the identity mark share a centre line (ULI-L07, ULI-L10).",
          "evidence": [
            "tests/conformance/app.spec.js › app-today: no overflow or clipping at 320/390/768/1280, declared groups align or stack in order (ULI-L01, ULI-L05, ULI-L09, ULI-L10): ULI-L01 PASS @320px (row) — center-edge delta 0.01 CSS px <= tolerance 1 CSS px",
            "tests/conformance/app.spec.js › app-today: no overflow or clipping at 320/390/768/1280, declared groups align or stack in order (ULI-L01, ULI-L05, ULI-L09, ULI-L10): ULI-L01 PASS @390px (row) — center-edge delta 0.01 CSS px <= tolerance 1 CSS px",
            "tests/conformance/app.spec.js › app-today: no overflow or clipping at 320/390/768/1280, declared groups align or stack in order (ULI-L01, ULI-L05, ULI-L09, ULI-L10): ULI-L01 PASS @768px (row) — center-edge delta 0.01 CSS px <= tolerance 1 CSS px",
            "tests/conformance/app.spec.js › app-today: no overflow or clipping at 320/390/768/1280, declared groups align or stack in order (ULI-L01, ULI-L05, ULI-L09, ULI-L10): ULI-L01 PASS @1280px (row) — center-edge delta 0.01 CSS px <= tolerance 1 CSS px"
          ]
        }
      ],
      "actions": [
        {
          "id": "shell.skip",
          "control": {
            "role": "button",
            "name": "Skip to content"
          },
          "intent": "Move keyboard focus past the navigation",
          "expectedOutcome": "Focus moves to the page's main region; the address is unchanged [owner: engine: skipToContent; state: local, empty]",
          "status": "pass",
          "evidence": [
            "tests/browser/app-deep-links.spec.js › the skip link moves focus to the content and leaves the address alone: passed (asserts the outcome)"
          ],
          "resetStrategy": "fresh page per test"
        },
        {
          "id": "shell.nav-today",
          "control": {
            "role": "link",
            "name": "Today"
          },
          "intent": "Go to today's ledger",
          "expectedOutcome": "Address becomes #/ and the Today screen shows [owner: route table (Places.fs); state: local, empty]",
          "status": "pass",
          "evidence": [
            "tests/conformance/app.spec.js › primary navigation reaches each place by its link at 1280px (ULI-A01, ULI-A02, ULI-A06): ULI-A02 PASS — expected post-state observed after activation",
            "tests/conformance/app.spec.js › primary navigation reaches each place by its link at 390px (ULI-A01, ULI-A02, ULI-A06): ULI-A02 PASS — expected post-state observed after activation"
          ],
          "resetStrategy": "fresh page per test"
        },
        {
          "id": "shell.nav-track",
          "control": {
            "role": "link",
            "name": "Track"
          },
          "intent": "Go to the timer and manual entry",
          "expectedOutcome": "Address becomes #/track and the Track screen shows [owner: route table (Places.fs); state: local, empty]",
          "status": "pass",
          "evidence": [
            "tests/conformance/app.spec.js › primary navigation reaches each place by its link at 1280px (ULI-A01, ULI-A02, ULI-A06): ULI-A02 PASS — expected post-state observed after activation",
            "tests/conformance/app.spec.js › primary navigation reaches each place by its link at 390px (ULI-A01, ULI-A02, ULI-A06): ULI-A02 PASS — expected post-state observed after activation"
          ],
          "resetStrategy": "fresh page per test"
        },
        {
          "id": "shell.nav-month",
          "control": {
            "role": "link",
            "name": "Month"
          },
          "intent": "Go to the monthly record",
          "expectedOutcome": "Address becomes #/month and the Month screen shows [owner: route table (Places.fs); state: local, empty]",
          "status": "pass",
          "evidence": [
            "tests/conformance/app.spec.js › primary navigation reaches each place by its link at 1280px (ULI-A01, ULI-A02, ULI-A06): ULI-A02 PASS — expected post-state observed after activation",
            "tests/conformance/app.spec.js › primary navigation reaches each place by its link at 390px (ULI-A01, ULI-A02, ULI-A06): ULI-A02 PASS — expected post-state observed after activation"
          ],
          "resetStrategy": "fresh page per test"
        },
        {
          "id": "shell.nav-more",
          "control": {
            "role": "link",
            "name": "More"
          },
          "intent": "Go to reference data and session settings",
          "expectedOutcome": "Address becomes #/more and the More screen shows [owner: route table (Places.fs); state: local, empty]",
          "status": "pass",
          "evidence": [
            "tests/conformance/app.spec.js › primary navigation reaches each place by its link at 1280px (ULI-A01, ULI-A02, ULI-A06): ULI-A02 PASS — expected post-state observed after activation",
            "tests/conformance/app.spec.js › primary navigation reaches each place by its link at 390px (ULI-A01, ULI-A02, ULI-A06): ULI-A02 PASS — expected post-state observed after activation"
          ],
          "resetStrategy": "fresh page per test"
        },
        {
          "id": "shell.copy-link",
          "control": {
            "role": "button",
            "name": "Copy link"
          },
          "intent": "Copy an absolute link to the current view",
          "expectedOutcome": "\"Link copied.\" is shown and the clipboard holds the view's address [owner: engine: copyLink; state: local, empty]",
          "status": "pass",
          "evidence": [
            "tests/conformance/app.spec.js › Copy link says it copied, and the clipboard holds the view's address (ULI-A02, ULI-A07): ULI-A02 PASS — expected post-state observed after activation"
          ],
          "resetStrategy": "fresh page per test"
        },
        {
          "id": "shell.timer-chip",
          "control": {
            "role": "button",
            "name": "Running timer chip"
          },
          "intent": "Return to the running timer",
          "expectedOutcome": "Address becomes #/track [owner: engine: goTrack; state: local, timer running, away from Track]",
          "status": "pass",
          "evidence": [
            "tests/conformance/app.spec.js › the timer runs, pauses, and its chip leads back to it from elsewhere (ULI-A02, ULI-L10): ULI-A02 PASS — expected post-state observed after activation"
          ],
          "resetStrategy": "fresh page per test"
        }
      ],
      "evidence": [
        "tests/conformance/app.spec.js › every enabled action on every screen is declared, empty and with records, at 1280px (ULI-A01, ULI-A09, ULI-A10): ULI-A10 PASS — every enabled, visible action is declared in chrona.contract.mjs",
        "tests/conformance/app.spec.js › every enabled action on every screen is declared, empty and with records, at 390px (ULI-A01, ULI-A09, ULI-A10): ULI-A10 PASS — every enabled, visible action is declared in chrona.contract.mjs",
        "tests/conformance/app.spec.js › the navigation's labels stay whole at every width and at 200% text (ULI-L06, ULI-L09): ULI-L06 PASS @320px — content fits; box on screen",
        "tests/conformance/app.spec.js › the navigation's labels stay whole at every width and at 200% text (ULI-L06, ULI-L09): ULI-L06 PASS @320px — content fits; box on screen",
        "tests/conformance/app.spec.js › the navigation's labels stay whole at every width and at 200% text (ULI-L06, ULI-L09): ULI-L06 PASS @320px — content fits; box on screen",
        "tests/conformance/app.spec.js › the navigation's labels stay whole at every width and at 200% text (ULI-L06, ULI-L09): ULI-L06 PASS @320px — content fits; box on screen",
        "tests/conformance/app.spec.js › the navigation's labels stay whole at every width and at 200% text (ULI-L06, ULI-L09): ULI-L06 PASS @390px — content fits; box on screen",
        "tests/conformance/app.spec.js › the navigation's labels stay whole at every width and at 200% text (ULI-L06, ULI-L09): ULI-L06 PASS @390px — content fits; box on screen",
        "tests/conformance/app.spec.js › the navigation's labels stay whole at every width and at 200% text (ULI-L06, ULI-L09): ULI-L06 PASS @390px — content fits; box on screen",
        "tests/conformance/app.spec.js › the navigation's labels stay whole at every width and at 200% text (ULI-L06, ULI-L09): ULI-L06 PASS @390px — content fits; box on screen",
        "tests/conformance/app.spec.js › the navigation's labels stay whole at every width and at 200% text (ULI-L06, ULI-L09): ULI-L06 PASS @768px — content fits; box on screen",
        "tests/conformance/app.spec.js › the navigation's labels stay whole at every width and at 200% text (ULI-L06, ULI-L09): ULI-L06 PASS @768px — content fits; box on screen",
        "tests/conformance/app.spec.js › the navigation's labels stay whole at every width and at 200% text (ULI-L06, ULI-L09): ULI-L06 PASS @768px — content fits; box on screen",
        "tests/conformance/app.spec.js › the navigation's labels stay whole at every width and at 200% text (ULI-L06, ULI-L09): ULI-L06 PASS @768px — content fits; box on screen",